MENU_NAME,DATA
고구마순스파게티,백종원 맛남의광장챌린지  프로젝트꽃에 출품했던 요리 입니다. 네이버 홈 푸드판에 올랐었던 음식이예요 ^^
감자오믈렛피자,아침밥을 먹기 싫어하는 가족들을 위하여 가지고 있는 음식재료를 가지고 간단하게 만든 음식. 아침 굶지 말고 출근 하세요~~^^
방울토마토꽂이,방울토마토 그냥 먹으면 재미 없잖아요~. 예쁘게 요리 해서 맥주 안주로 먹어도 좋고  도시락 반찬으로도 아주 좋답니다.
소고기하트피자,수험생  직장인들이 아침에 일어나면 밥을 먹지 않으려고 하여서 만들어 본 요리 입니다. 밥 대신에 요즘 젊은세대들이 좋아하는 음식재료들로 만든 소고기 하트피자~~*^^*
오크라토마토조림,채소의 한 종류인 오크라는 여자 손가락 모양과 비슷하다 하여 레이디핑거라고도 불립니다. 오크라에는 뮤신  펙틴과 같은 성분들이 함유되어 있습니다. 이러한 성분은 콜레스테롤의 수치를 낮춰주는 역할을 합니다. 또한 칼륨 성분은 체내 노폐물을 밖으로 배출하도록 도와줍니다. 오크라와 낫토는 함께 섭취했을 때 오크라가 낫토에 들어 있는 단백질의 흡수를 돕기 때문에 최상의 궁합입니다.둘 다 식물 섬유를 풍부하게 함유하고 있기 때문에 변비 개선과 대장암 예방에도 효과적입니다.  * 오크라 고르는 방법 * 1. 표면에 솜털이 빽빽이 나 있는 것 2. 콩깍지의 녹색이 짙은 것 3. 일직선으로 매끈한 것 4. 각이 확실히 나 있는 것  00:10 오크라 손질법 02:29 오크라 토마토조림 ( 터키식 스타일 )
소세지또띠아샌드위치,이번에 간만에 샌드위치를 해먹었는데 요거요거 식사 한 끼 챙겨 먹기 너무 간편하면서 맛도 좋아서 속이 든든하더라구요 채소와 함께하니 건강한 느낌도 나구요 :)
짜르보나라라면,요즘 라면조합이 대세이죠 생각보다 괜찮은 까르보나라 라면
닭다리살피자,휴일에 배달해 먹는피자보다는 엄마가 직접 만든 닭 고기를 이용한 피자  손님대접 요리에도 좋고 술안주에도 좋으며  아이들 간식에도 아주 좋은 음식이다.
어묵치즈구이,어묵치즈구이라니!!!  벌써부터 그냥 맛있을 것 같쥬?ㅋㅋ  어묵치즈구이는 백종원님의 레시피이기도 해요!  김밥용 김까지 함께 샌드해서 어묵치즈구이를 만들면  비주얼 뿜뿜이예요 *^^*  고소하고 짭쪼롬한 어묵치즈구이 만들기 ♥  우리 함께 김어묵치즈구이로 구워보아요 :) 
상추전,쌈으로 먹다 남은 상추 버리지 말고 상추전요리해보세요
감자부추말이,요즘 감자가 맛이 있어서 응용하여 도시락 반찬을  만들어 보았다. 제철에 나오는 음식재료들은  보약같은 느낌이 들어서 자주 해먹고 건강해 지면  좋을것 같다.
아보카도까나페,아보카도는 비타민과 미네랄이 많은 건강과일이다. 과육은 높은 지방분  단백질 함유량을 가지며 단맛은 없다. 과실은 버터 프루츠라는 별명이 붙을 만큼 샐러드 등에 사용되는 야채로 많이 이용된다. 이뇨작용이 있는 잎을 우려내서 마시면 간을 깨끗하게 하고 고혈압을 낮춘다.  * 아보카도 손질법 * 1. 아보카도는 씨를 중심으로 반으로 자른다. 2. 자른 아보카도는 손으로 비틀어 준다. 3. 가운데 씨는 칼날을 꽂은 뒤 살짝 비틀어 뺀다. 4. 껍질과 과육 사이에 숟가락을 넣어 과육을 분리한다.  00:08 아보카도 손질법 00:35 아보카도 카나페
바지락술찜,초간단 바지락 술 찜 오동통하니 맛나요
주먹밥계란부침,간단하게 주먹밥을 만들어서 영양많은 달걀을 입힌 주먹밥 계란부침 입니다. 아이들 집밥으로도 좋고  도시락 메뉴로도 아주 좋은 간단 주먹밥 요리 입니다.
옥수수스프,뭐니뭐니해도 여름날 최고의 간식중에 하나는 옥수수죠.  마트에 갔더니 초당옥수수가 나왔길래 사다가 야식으로 쪄서 먹었는데  제철이라 그런가 달콤달콤~ 너무 맛있더라구요^^  조금 남아서 알갱이만 따로 빼서 보관했다가 다음날 딸아이가 좋아하는 옥수수스프  아들이 좋아하는 피자를 만들었어요.  옥수수찹쌀피자는 이번에 새롭게 제가 개발한 레시피예요. 대부분 밀가루 도우에 옥수수 토핑을 얹어 피자를 만드는데  전 찹쌀가루에 옥수수를 넣어 바삭하게 팬에 구운 뒤에 모짜렐라치즈를 얹어 고르곤졸라피자처럼 꿀을 찍어 먹었는데  떡인듯 피자인듯~ 넘 맛있었어요. 강추합니다^^  옥수수의 마지막 한알까지 맛있게 먹는 두 가지 요리~?  자~ 그럼 만들어 볼까요~^^
부추부침개,부추를 보는 순간 . 번쩍 부침개가 생각이 났어요. 제가 요리를 하면 요리는 아니지만 암튼 하게 되면 양을 많이 하는 편이에요
감자피자,오늘은 NO 오븐! NO 밀가루! But  YES 맛! YES 건강! 인 감자피자를 만들어보겠습니다. :)
치즈감자그라탕,요즘 감자가 많이 생겨서 있는 감자요리 총동원중입니다.^^  계량: 스푼-성인숟가락
라따뚜이,요즘 토마토 가지 호박이 많은계절 이 재료를 고급지게 만들어 보려합니다.
계란프리타타,밤에 먹어도 부담스럽지 않은 영양만점 계란프리타타입니다 알록달록 비주얼도 예쁘고 계란팬케이크에 가까운 달걀요리라 보시며 됩니다 고소하고 부드러워 먹고나도 속이 편안해요~
스팸무스비,요즘 식사를 챙겨먹는 버릇을 들였더니  새로운 고민이 생기더라구요  공감하시죠?  오늘은 뭐 해먹을까  특히 간단하게 해결해야하는 아침이 젤 고민  오늘 아침은 집에있는 스팸과 계란으로 만드는  예쁘고 맛있는 스팸무스비입니다!  만드는방법도 쉽고 간편해서 아침식사로 안성맞춤  ?
케이준치킨샐러드,페밀리레스토랑에서 먹던 케이준치킨! 항상 맛있네. . .
장어튀김,장어는 소금구이로 먹어도 맛있고  빨간 양념구이도 맛나지만 이렇게 튀겨먹어도 또다른 별미인것 같아요. 고단백 식품이 장어는 코로나 이길수있는 면역력을 기르는데는 이만한게 없죠? 
바지락술찜,안주로도 딱  손님 초대요리로도 딱! 집밥 메뉴로도 딱인 간단하면서 맛있는 바지락술찜이예요.
치킨또띠아랩,아이들 아침식사 또는 간식  그냥 편하게 한끼 해결!
돈가스피자,돈가스도 좋아하고 피자도 좋아 하는 아이들을 위하여 만들어 본 요리. 맥주 안주로도 좋고 한끼 식사로도 아주 좋은  속이 든든한 요리 입니다.
돈가스,돈가스 무슨말이 필요합니까  그냥 맛있는 음식이죠!
두부치킨너겟간장조림,냉장고에 있는 재료들을 가지고 만든 냉파 요리~~*^^* 냉장고 자투리 재료들을 반찬으로 만들어 먹는 일이 이젠 일상이 되어버린 요즘. 뭐 먹을까 고민될때 한끼 반찬으로 좋은  두부 치킨너겟 간장조림이다.
통삼겹살구이,통삼겹살 담백하게 만들어 볼께요.
계란만두,저는 당면과 계란을 무척 좋아해서 집에 항상 구비해 두고 있는데요. 늦은 밤  갑자기 야식이 당길 때 집에 있는 당면과 계란을 사용해 당면계란만두를 만들어 먹곤 한답니다. 
돈까스샐러드,돈까스를 색다르게 먹고 싶을땐 돈까스 샐러드로 새롭게! 손님초대나 더운날씨엔 너무 좋답니다돈까스
연어스테이크,간단하지만 있어보이는 요리 바로 연어 스테이크입니다.
감자채치즈전,감자 철인 요새 감자요리를 놓칠 수 없죠! 감자로 뭐해 먹을지 고민하다가 최고의 요리비결에서 보았던 감자채 치즈전에 도전해보았어요. 아주 간단하게 만들 수 있으니 쉽게 따라해보세요!
계란만두,오늘은 방탄소년단 지민 님이 추천한 계란 만두를 만들어 봤답니다. 부산 서동시장 명물인 계란 만두인데 지민 님이 어릴 적부터 자주 즐겨먹는 음식이라고 하네요^^ 재료는 간단한데 정말 맛있어요! 꽉 찬 당면의 탱글탱글한 식감이 너무 좋더라고요^^ 떡볶이 국물에 비벼 먹고 싶은 맛~! 집에서 꼭 만들어 드셔보세요~
가지피자,항암효과에 좋은 가지!  가지를 도우 대신 만들어  가지 싫어도 무한대로 먹기 가능한 레시피!  쉽고 간단해서 아이들 간식으로도 딱!  집에서 만들어 먹기도 간편!  쉽고 간단한 레시피로 제철 가지 꼭! 챙겨드세요!!!  세상의모든레시피 만개의레시피 
꽈리고추대패삼겹살꼬지,야식이면서 동시에 안주를 먹고 싶어서 만들었습니다.  어른 아이 모두 좋아합니다.
떡갈비규리또,이번엔 닭이 아니여도 우승!  무려 4번째 우승& 출시!  멕시코 부리또를 한식 스타일로 만들어  편의점 간편식으로 완벽한 메뉴!  편스토랑 이경규의 떡갈비규리또 집에서 따라해보기!!!  세상의모든레시피 만개의레시피 
크림새우,비싼 중국집 요리를 집에서 저렴하고 맛있게 만들어 보아요
버터갈릭새우구이,저희 부부는 늦은 밤  맥주 한 캔과 즐기는 야식을 무척 좋아하는데요. 야식은 뭐니뭐니해도 만들기 편하고  치우기 쉬운 요리가 최고죠! 오늘 소개해드릴 버터갈릭새우구이가 바로 그런 요리랍니다!!!
웨지감자,에어프라이로로 쉽고 맛있는 야식 만들기
콩나물전,장맛비가 주적주적 내릴때 콩나물 부추전 초간단 맛있는 전
고구마수플레오믈렛,주말 브런치로 맛남의 광장에서 봤던 고구마수플레오믈렛을 만들어 봤어요!! 늦게 일어나 아침을 안먹는 저에게 브런치로 딱인 메뉴인것 같더라구요^^ 수플레 정말 좋아해서 여기저기 많이 먹으러 다녔었는데 밀가루가 들어가지 않은 오믈렛 수플레는 어떤 식감과 맛일지 궁금했어요 :)
토마토달걀볶음,제가 즐겨보는 유투브 채널중 하나!! 백종원 요리비책 재미있기도 하고 요리 꿀팁도 많이 알려주시고 쉽게 상황에 따라 이것저것 응용하는 방법도 많이 알려주셔서 좋은거 같아요. ㅋㅋ 보고 있노라면 귀여운 PPL은 왠지 꼭 사서 써보고 싶은 충동이 들더라구요. ?  요즘 정신이 없어서 오랜만에 봤더니 토마토달걀볶음 레시피가 올라왔더라구요. 예전에 야간매점? 에서 나와서 따라해봤던 기억이 있는데 만드는 방법이 다르기도 하고 이렇게 만들면 어떤맛이 나올지 궁금해서 저녁반찬으로 만들어 봤어요^^ 토마토만 있으면 재료는 간단합니다!! ?
팟시금치무쌉,만남의 광장  팟시금치무쌉 만들기 시금치요리 요즘 거의 본방 사수 하고 있는 '맛남의 광장' 나오는 요리마다 신박하기도 하고 왜이리 맛있어 보이는지.. 이번엔 팟시금치무쌉을 만들어 봤어요^^ ?
반건조오징어허니버터구이,비오는날 시원한 맥주한잔과 함께 먹으면 맛있는 허니버터 오징어구이 달콤한 허니갈릭버터 소스에 오징어 감칠맛이 폭발해요. 집에서 고소한 버터향과 함께 비오는 소리 들으면서 드셔보세요.
라따뚜이, 아주 초간단이지만 비주얼은 최고인 음식 라따뚜이를 소개해드려요!! 
단호박에그슬럿,단호박 에그슬럿은 단호박의 속을 파내고  달걀과 치즈를 넣어서 익혀 먹는 음식이예요~  이름만 들었을 때는 왠지 모르게  만들기 어려울 것 같지만  정말정말 간단해서 평상시에  간식으로 만들어서 먹어도 좋을 것 같아요!  치즈가 듬뿍 들어간 단호박 에그슬럿 만들기 ♥  우리 함께 전자레인지랑 오븐으로 만들어요 :) 
옥수수전,백종원님의 옥수수전은 만들기 간단한데다가  맛도 보장된 간단한 간식 요리예요~  옥수수전은 먹을 때마다 입안에서  옥수수알맹이의 톡톡 터지는 식감이 너무 좋더라구요!  술안주로도 좋은 백종원 옥수수전 만들기 ♥  우리 함께 크게 한 판 부쳐보아요 :)
소시지콘치즈,안녕하세요  이웃사슴입니다 ●'-'●)?♥ 오늘은 맥주와 아주 잘 어울리는 술안주  소시지 콘치즈 레시피를 가져왔어요! 
브런치,아침 식사 대용으로 준비한 냉파요리. 커피 한잔이나 우유 한잔과 함께 같이 먹으면  속이 든든한 브런치. 아침 굶지말기~~.
옥수수전,전분가루를 이용해 옥수수전을 만들면 더욱 바삭하면서도 맛있게 즐길 수 있어요.
불고기김치퀘사디아,옛날 중국의 황제는 얼마나 많은 여인을 취했을 지 사이즈가 비교도 안 되게 작았던 우리 나라의 왕실을 봐서도 얼핏 짐작할 수 있을 것 같다. 그 황제의 총애를 잃어 버린 수 많은 후궁들과 여인들은 냉궁 이란 곳으로 보내져 평생을 잊혀진 채 살았다고 한다.    또띠아를 한 봉지 사면 끝까지 먹게 되지가 않아서 마지막 몇 장은 꼭 냉동실에 들어 가게 되는데 이때면 어김없이 잊혀진 후궁들이 유폐 되었다는 냉궁이 떠 오르곤 한다. 냉궁으로 버려진 또띠아들은 여간해선 다시 꺼내게 되지 않아 중국 황제 뺨치는 매정 함으로 그들을 잊고 지내기 일쑤여서 한 번은 또띠아로 만들 수 있는 음식을 모아 본 적도 있다. 어느 날 잠깐 들른 지인에게 불고기와 김치 볶음을 넣은 퀘사디아를 만들어 주고 좋은 평을 들었는데…  이런! 인터넷을 뒤지다 보니 불고기 김치 퀘사디아는 나만 만드는게 아니었다능… ㅜㅜ 
배추부침개,고소한 맛이 일품인 배추전 만들어 볼께요
토마토칠리새우,비건새우는 콩과 곤약으로 만들어진 새우랍니다 ^^  콩과 곤약으로 만든 새우라  건강도 챙기고 다이어트 음식으로도 좋을 것 같은데요!  비건새우에 몇 가지 양념만 추가하면  근사한 간식&주전부리 요리가 만들어져요.  매콤달달한 튀김 간식 비건 토마토 칠리새우 만들기 ♥  우리 함께 튀기고 볶아보아요 :) 
멘보가지,식빵이 없어도 제철 가지로 만드는 멘보샤!  일명 멘.보.가.지!  동글동글한 모양이 마카롱같아 0_0 에어프라이어로 만들어 실패 걱정 노노!  속.촉 담백한 에어프라이어 멘보샤 bb 세상의 모든 레시피 만개의레시피 
감자뇨끼,비 오는 날에 꼭 생각나는 수제비~ 요즘처럼 비가 자주 오는 날엔 수제비 대신 특별한 감자 뇨끼를 만들어보아도 너무 좋을 것 같아요.  ? 
메밀전병,비가 매일 내리네요. 이런 날은 부침개가 많이 생각나죠~~. 시중에 파는 김치의 강한 맛이 나는 메밀전병 말고 순하고 고소한 속 재료들을 넣어서 메밀전병을 만들어 봤어요. 드시고 힘 내세요 ^^
명란마요파전,안녕하세요 유투브 '왜 사먹니' 채널입니다.  파전을 색다르게 즐기고 싶어서 시도해봤는데 정말 너무 맛있어요. 명란 마요의 또다른 변신 퓨전파전으로 즐겨보세요!! 영상에 수제막걸리 만드는 방법과  다양한 파전 레시피를 올려두었습니다!  영상과 레시피 재밌게 보시고~ 좋아요 구독 댓글 부탁드려요^^  채널구독링크 https://bit.ly/3iqGZDw  인스타그램 Instagram @whybuyfood https://www.instagram.com/whybuyfood (재료는 파전 2장을 만들 수 있는 양 입니다)
옥수수튀김과자,요즘 한창 출하 되는 옥수수를 가지고  바삭한 과자 처럼 만들어 보았어요 겉은 바삭하고  속은 쫀득쫀뜩 고소하고 맛있어요  
청경채프리타타,다이어트 도시락 스타일로 저탄고지 청경채프리타타를 만들어봤어요
또띠아피자,아이들 간식으로 좋은 또띠아 피자 만들어 볼께요.
무파라면,해장라면으로 좋은 무파라면
단호박치즈볼,단호박치즈볼 아이반찬  간식 다 좋아! 
토마토카레,카레에 토마토를 넣으면?!  뒷맛이 시원하고 상큼한 맛의 스튜같은 맛!  카레의 특유의 향이 싫어도 토마토카레는 후룩후룩 떠먹기 좋아요! 밥이 싫다면 파스타로 먹어도 좋겠죠?!  세상의모든레시피 만개의레시피 
웨지감자,일반 큰 감자로 웨지감자를 만들어도 되지만  저는 귀여운 알감자로  미니미니한 웨지감자를 만들었어요 ^^  재료도 간단하고 만들기는 더더 간단해서  초간단 간식으로 만들어 먹기 정말 좋답니다~  짭쪼롬한 웨지감자 만들기 ♥  우리 함께 한입에 쏙 먹어보아요 :) 
폭립,제가 여태 등갈비 요리를 하면서 폭립은 두번째로 만들었어요 폭립은 일단 신맛이 있어 얘들이고 저고 썩 좋아하는 음식이 아닌 이유이죠  특히 밖에서 사먹는건 더 그렇고요 그래서 집에서 폭립을 한번 해줬는데 그때 반응이 영 시원찮아 그 다음부턴 안하게 되더라고요  그러다 이번에 등갈비찜을 해줄까 하다 폭립을 만들어 봤어요 전에 치킨소스를 만들었을때 너무 맛있다고 잘먹어 그맛으로 하면 잘먹을것 같더라고요  아니나 다를까 맛있다고 너무 잘먹네요 고기구신들이 고기보다 소스가 더 맛있다며 소스가 맛을 살렸다는 극찬까지 아끼지 않았어요ㅋ  전혀 시지않은 맛으로 누구나 맛있게 먹는 폭립 집에서 좀더 고급지게 즐기세요^^  오늘도 건강 유의하세요~♡ 
참외깍두기,과일로만 여겨지던 참외는 안녕!!!  달달한 맛의 아삭한 맛까지 여름철 BEST 식재료가 되는  참. 외!  갈증해소에도 최고인 시원한 참외요리 3가지로  시원한 여름 보내세요! 세상의모든레시피 만개의레시피
전복버터구이,보양식으로 좋은 버터구이 만들어 볼께요.
크래미무쌈말이,먹기 아까울 정도의 대접 요리 크래미 무쌈말이를 만들어 보아요
와플피자,와플 위에 피자토핑이 듬뿍 올라가져있는  와플피자예요.  피자하면 일반적으로 납작평평한 반죽으로  피자를 만드는데요~  특별하게 디저트로 흔히 먹는 와플로  와플피자를 만들었어요 ^^  와플메이커로 와플피자 만들기 ♥  우리 함께 치즈를 듬뿍 올려요 :) 
파게트,간단하고 맛있는 간식으로 파게트 만들어 볼께요.
떡갈비피자,종일 더위와 싸우고 퇴근하여 시원한 맥주가  생각 날때 코로나 때문에 음식저 가기도 힘든데 집에서 만들어 본 떡갈비 피자. 맥주 안주로 아주 좋은것 같다.
월남쌈,야채를 많이 먹게 되어 가끔 먹으면 너무 좋은것 같아요. 속재료는 칵테일새우   오리훈제  닭가슴살 등 다 좋아요. 
만두소세지꼬치,간단하게 만들 수 있는 만두비빔밥이예요 ^^  만두비빔밥만 먹으면 너무 아쉽고 허전하잖아요~~~  그래서 사이드 메뉴로  만두소세지꼬치도 함께 준비했어요.  보기만 해도 배부른  만두소세지꼬치 & 만두비빔밥 만들기 ♥  우리 샘표 만두가 맛있어지는 간장소스와  함께 비벼 먹어요 :) 
블루밍어니언,양파를 이용해서 양파꽃튀김  즉  블루밍 어니언을 만들었어요 ^^  여기서 '블루밍'이란 '활짝 꽃 핀'이라는 뜻을  가지고 있어요.  만드는 과정은 손이 많이 가지만  그만큼 하나씩 뜯어먹는 맛이 있답니다~  맥주안주로도 좋은 블루밍 어니언 만들기 ♥  우리 함께 에어프라이어로 튀겨요 :) 
단호박두루치기찜,단호박의 달달함과 두루치기의 칼칼함  그 위에 치즈를 올려 환상적인 맛을 낸 요리  손님 초대 요리에 좋고 집들이 음식에도 아주 좋은 음식이다.
라면전,갑자기 문뜩 라면으로 전을 부쳐서 먹으면 어떨까라는 마음을 가지고 직접 해서 먹어봤습니다.
식빵핫도그,나가서 사 먹기 귀찮을 때는 집에서 쉽게 핫도그를 만들어 보아요
소고기말이,손님초대요리로 굿인 소고기 야채말이 만들어 볼께요.
양배추전,정식품 콩국물을 이용한 요리가 뭐가 있을까? 하다가 처음 떠오른 레시피
매콤콩크림닭갈비,매콤달콤한 닭갈비에 고소하고 진한 콩국물을 넣어 만든 고추장크림 닭갈비. 맛있는 닭갈비와 마무리로 고소한 볶음밥까지!! 든든하고 맛있는 한끼 손님초대요리로도 좋아요 :) 
푸주파스타,20년 가까이 채식을 하고 있어서 평소에 새로은 채식 식재료에 관심이 많아 콩으로 만든 푸주를 정식품 진한 콩국물에 불려서 콩이 주재료가 되는 건강하고 다이어트식인 채식 퓨전 파스타를 만들어 보았습니다. 
산마그라탕,영양이 많은 산마를 정식품 진한 콩국물에 향신료 넣어서 조려내고  오븐 구워내어 건강한 채식 그라탕을 만들어 보았습니다. 
청어알젓두부,몇주전에 거제도여행에서 맛집이라고 간 선술집에서 딸이 유명하다는 안주로 청어알젓두부를 시켰어요  맛을보는데 이것 또한 아는맛인데 처음으로 맛보는 맛이더라고요 그야말로 신선한 맛이였어요  하지만 생각보다 양이 적어 많이 아쉬웠죠 그래서 집으로 돌아오는길에 시장에 들러 청어알젓을 미리 사다놨지요  그러다 딸과 한잔할려고 청어알젓두부를  만들었어요 전 처음에 청어알젓두부라 해서 젓국으로 두부찌개를 끓이는줄 알았거든요ㅋ 근데 생두부에 싸먹는거라 매우 새롭게 느꼈던거 같네요  맛은 간단한 술안주로 질리지 않고 먹을수 있어 괜찮은 맛잇듯 해요  누구나 쉽고 빠르게 만들어 먹을수 있는 청어알젓두부 가벼운 술안주요리로  해드셔보세요^^  오늘도 건강 유의하세요~♡ 
취나물페스토파스타,안녕하세요.  이번에 소개해드릴 요리 레시피는 '취나물 페스토 파스타'입니다.  취나물을 너무 많이 사다놔서 한번에 처리 할 수 있는 방법이 뭐가 있을까? 생각했어요. 그러다가 서양에는 바질페스토가 있듯이  한국식으로 취나물 페스토를 만들어보자!  해서 탄생한 취나물 페스토 파스타 레시피 에요.  취나물의 특유 씁쓸한 맛이 특징이지만 잣과 구운마늘과 치즈가 들어가서 풍미과 감칠맛이 확 사는 정말 특별하고도 초간단 파스타에요. 
파프리카콘치즈,평일 저녁에는 되도록이면 간단하게 가볍게 먹으려고 해요.. 다이어트 차원에서..ㅋ 그래도 가끔 자기전에 못참겠을때가 있어요.. 그럴땐 전 간단히 콘치즈를 먹어요 ㅋㅋ 횟집에서 반찬으로 손바닥 만큼 주셔서 아쉬움이 있을때도 집에서 넓~직한 후라이팬에 간단하게 해먹을수 있어요
감자채전,감자채전
레몬콩크림새우,?상큼하면서도 구수한 레몬 콩크림새우예요 ^^ 새우를 좋아하시는 분들은 크림새우도 좋아하실 것 같은데요! 중국집에서 파는 그 크림새우를 집에서도 만들 수 있어요. 근사한 비주얼을 뽐내는 레몬 콩크림새우 만들기 ♥ 우리 정식품 콩국물과 함께 해요 :)
바질페스토감자볶음,사회적거리두기로 브런치식당가는 것도 멈칫하게 되지요. 초간단 메뉴로 집에서 브런치먹는 기분한번 내볼까요?
열무국수,여름 대표 메뉴인 열무국수를 만들어봤어요. 열무김치국물을 미리 얼음틀에 얼려서 넣으면 끝까지 먹을때까지 국물이 안 밍밍해져요! 여기에 달달하게 곶감을 넣는게 팁입니다. 
크레이프,진한 콩국물로 반죽한 크레이프와 진한 콩국물 검은콩이 베이스 된 로즈마리 빈스크림  진한 콩국물로 만든 콩크림잼을 곁들여 차려낸 브런치 한 접시 세트
토마토김치말이국수,건강에 좋은 토마토를 듬뿍~ 넣어 만든 시원하고 뒷맛까지 깔끔한 토마토 김치말이 국수 레시피 :)
애호박치즈,애호박요리에요 ㅎㅎ  남은 애호박으로 만드는 간단한 안주!!!  매우 쉽기때문에 누구나 할수 있습니다 ㅎㅎ  콘치즈가 아닌 애치즈입니다!!!
새우콩쌀국수,?이름만 봐도 특별할 것 같은 느낌이죠?ㅋㅋ 일반적으로 쌀국수는 국물이 맑은데요! 제가 만든 쌀국수는 걸쭉하면서도 개운하고 시원한 맛을 느끼실 수 있답니다! 탱글한 새우가 들어있는 새우 콩쌀국수 만들기 ♥ 우리 이번에도 정식품 콩국물과 함께 해요 :)
라면땅,간식
고구마샐러드,간식
마요네즈간장양념치킨,살로만 포장되어 있는 냉동치킨 한 봉지를 가지고 고추장 양념치킨과 마요네즈 간장양념 치킨을  만들어 주말에 집에서 치맥파티를 하였다.
빠네크림파스타,아이들이 좋아하는 빠네크림파스타를 한국식으로 고소하게 만들어봤어요.
