MENU_NAME,DATA
불닭크림파스타,안녕하세요 남은 후라이드 치킨을 냉장고에 보관하고 어떻게 먹을지 고민이 많으실텐데요. 그냥 전자렌지에 데워 먹거나 치밥으로 먹을 수 있지만 오늘 진짜 맛있는 후라이드치킨 불닭크림파스타 레시피를 알려드리려 합니다!! 제가 좋아하는 남은 치킨요리 방법입니다.
토마토팍시,냉장고속 재료로 만드는 건강식 토마토 요리  토마토 팍시를 만들어 봅니다.
피자,오늘은 쌈두부를 이용한 건강한 다이어트 피자를 만들어봤어요 (블로그에 더 많은 레시피가 있어요 이웃 신청 환영해요^^) https://blog.naver.com/mabuce
매콤크림감바스,간식으로  안주거리로 쉽게 만들 수 있는 감바스! 우유를 넣으니까 꾸덕해지니 더 맛있네..?
두부김밥,밥 대신 두부 넣어 만든 두부김밥... 다이어트할때 먹으면 든든헌게 넘나 행복해져요.
명란치즈가래떡,가래떡은 구워서 꿀이나 조청에 찍어 먹으면 든든하고 맛있는 간식인데요.  달달한 맛도 좋지만 명란마요에 치즈까지 얹어서 드셔보세요. 지금까지 느껴보지 못한 색다른 맛을 느낄 수 있어요.
라이스페이퍼치킨,오늘은 기름에 튀긴 치킨이 아닌 라이스페이퍼로 건강한 치킨을 만들어 봤어요 (블로그에 더 많은 레시피가 있어요 이웃 신청 환영해요^^) https://blog.naver.com/mabuce
양배추피자,다이어트는 해야겠고..피자는먹고싶구~ 밀가루없이 양배추도우로 피자 만드는 초간단레시피
숙주라면,다이어트 중인데 라면이 너무 먹고싶어서 고민하다 만들었어요^^ 라면은 국물에 나트륨이 많아서 그렇지 면보다 국물은 칼로리가 낮다고 해서 면 대신 숙주를 넣었는데 왠만한 면빨 부럽지 않으니 꼭 만들어보세요♥
두부스테이크떡볶이,떡볶이를 먹으면서 단백질 충전을! 먹고 싶은 떡볶이를 참으며 힘들게 다이어트를 하는 작성자가 고민 끝에 만든 맛있는 레시피! 공유합니다?(?▽?*)o
어묵고구마피자,구멍뚫린 봉 어묵으로 색다른 요리를 만들어 볼게요 
옥수수볶음,구워먹는 옥수수도 맛있지만 우리가 자주 먹는 옥수수캔도 살짝만 조리해주면 너무 맛있답니다.  옥수수를 볶아주고 파마산 치즈에 라면스프  파슬리 가루를 뿌려주면 간식  안주로 완전 강추!
스프링롤,주말 간식으로 만들었는데 튀기긴 했지만 정말 건강한 간식입니다. 몇 개만 집어먹어도 배가 든든해지더라고요. 감자와 고구마 살짝 다르게 속재료 준비해서 만들었는데 정말 별미네요. 감자는 옥수수가 톡톡 터지는 맛이 있고 고구마는 치즈와 함께라 고소한 맛이 있어요. 결론은 둘 다 맛있습니다.:)
버섯크림소스볶음,크림파스타를 넘 좋아하는데 요즘 다이어트 중이라 못먹고 있어서 파스타면 대신 버섯과 채소로 간단하게 크림소스 버섯볶음 만들었어요^^
콘치즈피자,또띠아로 만드는 간단한 간식 옥수수콘과 치즈를 듬뿍 올린 피자! 너무 맛있어 자꾸 손이 가는 맛이에요~  간식으로도 좋고 집에서 맥주 한캔할때도 딱이에요
고구마채토스트,고구마 수확하는 계절이라 집에 고구마가 있으신 분들이 많을텐데요 고구마는 섬유소가 풍부하여 장건강에 좋아 변비에도 아주 좋다고 합니다 GI지수도 낮아 다이어트에도 좋다고 하니 얇게 채 썰어 빵없이 토스트를 만들어 드셔보세요 빵없이 바삭바삭 아침 대용이나 저녁 한끼로 추천해요
순두부숙주라면,요즘 다이어트로 밀가루끊기 중이라 순두부와 숙주로 면없는 키토라면 만들었어요^^
양배추피자,도우 대신 양배추를 활용해 만드는 피자 도우를 없애 탄수화물을 줄이고 햄 대신 훈제 닭가슴살을 넣어 칼로리도 줄이고
로제닭갈비,맛있는 닭갈비에 우유를 넣어 부드럽게 즐겨보세요. 매콤함에 부드러움이 더해져 오묘한 맛이 가히 중독적!  맛있으면 0칼로리란 말은 이럴 때 쓰는 게 아닐까..
고구마피자,고구마는 베타카로틴과 비타민 C 등이 들어 있어서 대표적인 알칼리성 식품이며  특히 폐암을 잘 예방하는 삼대 적황색 채소로 뽑혔어요. 한방에서는 비장과 위를 튼튼하게 하고 혈액을 편안하게 하며 따뜻하게 하는 효능이 있어 오장을 튼튼하게 해줍니다. 섬유질이 많아 배변활동에도 좋으며  다이어트에도 좋아요. 오늘은 밀가루 도우가 없는 노오븐 고구마 피자를 만들어 볼게요.
아보카도카나페,아보카도로 간단하게 와인안주를 만들어요.
고구마에그슬럿,고구마에 달걀과 치즈를 넣고 전자레인지에 돌리는 간단한 요리법이에요~^^ 맛있기도 하지만 참 든든해서 좋답니다.
참치두부밥,탄수화물을 줄이고 단백질은 늘리고! 밥 대신 두부를 활용한 한끼 식사 포슬포슬하게 볶아낸 참치와 두부가 너무 맛있어요
마라브리또,집에서 피크닉 기분을 내고 싶을 땐 뭐니뭐니해도 도시락이죠!  담백한 또띠아와 계란  야채  마라소스가 어우러진 마라포크 부리또 레시피를 소개해요~
알배추스테이크,요즘 핫하다는 메뉴죠!  겨울계절에 더불어 달달해진 재철채소인 단배추를 활용한 요리를 해봤습니다. 마치 고기를 시어링하듯 구워내니 아주 으뜸인 곁들임요리로 완성되더라구요. 노오란 속살이 먹음직스러운 오늘의 요리는! 스테이크곁들임 하기 좋은 알배추스테이크만들기입니다.
고구마피자,고구마가득일때 고구마피자 만들어보세요 아이들도 좋아하는 더먹는피자 되네요 
캐비지롤,저칼로리지만 배부르고 맛있게 먹는 고급요리 캐비지롤을 만들 수 있습니다. 양배추로 만든 양배추롤이라고도 하고 양배추말이 이기도 한 요리입니다.
감자피자,저희 집 아이들만 그런가요? 모짜렐라치즈만 넣으면 그냥 맛있다고 다 잘 먹더라고요. ?볶음밥에 올려도  옥수수캔에 올려도  식빵에 올려도 계란말이는 말할 것도 없고요. ?감자가 있어 감자에 모짜렐라 치즈만 녹여 감자피자 한판 준비해 보았습니다. ?든든하고 맛있고 그냥 단백해요. 감자와 치즈의 조합 괜찮지요? ?
바질페스토파스타,시금치페스토를 이용한 바질페스토파스타 만들기 입니다. 시금치 대신 바질을 사용하셔도 좋습니다.
고구마피자,찐 고구마를 도우로 한  팬피자 레시피 입니다. ~^^ 밀가루가 들어가 있지 않아 건강에 더 좋아요.
붉닭닭가슴살피자,배고파서 냉장고에있는 식빵과 닭가슴살로 후다닥 만든 떠먹는 피자~ 간단하게 만들어먹어요 
김밥미트볼피자,편의점 김밥은 많이 발전했다고는 해도 여전히 속이랑 맛이 아쉬울 때가 많아요. 이번에도 사봤지만...역시나 메인 재료는 콩알만큼 들어있고 아쉽더라고요. 그래서 아쉬운 김밥을 좀 더 풍족하고 이색적으로 먹을 수 있는 김밥미트볼피자 만들기입니다.
크림바질페스토만두그라탕,어디서 먹어본적도 ㅋㅋㅋㅋ 본적도 없는데요. 그냥 집에 있는 재료들로 만들어 봤어요. 근데 정말 맛있더라구요!!!
김치파스타,혼밥메뉴로 좋은 한그릇요리 김치스파게티입니다 우리나라 맛있는 김치가 전세계에 널리 알려져 외국인들도  맛있게 먹을 수 있는 김치요리가 있었으면 해 퓨전 김치요리 만들어 봤어요~ 외국인들도 좋아할 만한 김치 응용요리입니다 조선셰프 서유구의 김치이야기 정조지속 아름다운 우리김치와 새로운시도 참고 했습니다 
훈제연어또띠아피자,훈제연어와 크림치즈소스  토마토살사와의 꿀조합! 초간단하면서도 모양도 예쁘고 참 맛있는 훈제연어 또띠아피자입니다. 브런치메뉴  홈파티음식으로 강추드려요 
고구마전,찐고구마와 치즈의 조합으로 간식 만들었어요.
치킨피자,요즘엔 편의점에 가면 다양한 치킨 종류를 팔더라구요. 요고 그냥 먹어도 참 맛있지만  가성비 좋게 다양하게 활용하기에도 좋아요. 오늘은 쫄깃한 치즈와 톡 터지는 소시지를 더해서 맛과 식감을 더욱 풍족하게 만들어주는 치킨피자 만들기입니다. 편의점에서도 간단하게 만들수 있고 집에 남은 치킨이 있다면 활용하기도 좋아요.
삼각김밥크림리조또,삼각김밥으로 고급진 크림리조또 만들기
감자치즈구이,감자 요리인 치즈 감자구이를 준비했습니다.  고소한 치즈와 감자 구이는 간단하면서도 맛있습니다.
칠리치즈프라이,브리또나 타코 메뉴를 좋아하시는 분들이라면 더욱 더 취항저격인 칠리치즈프라이~  집에서 맛있게 즐길 수 있는 연말 메뉴 레시피를 소개합니다. :)
가지피자,도우를 가지를 이용해서 가지피자 만들기 해 볼께요.
닭가슴살고구마피자,닭가슴살 고구마피자 에어프라이어로 휘리릭 만들어요
순두부그라탕,토마토소스랑 모짜렐라치즈의 궁합을 좋아해서 만들어 봤어요 (22.11.24)
토마토비프스튜,토마토소스는 요리 활용도가 매우 높습니다.  누구나 좋아하는 맛인 토마토 스튜 만들기 레시피 입니다.  고기는 돼지고기  소고기 모두 가능 합니다.  토마토소스로 비프스튜 만드는 법을 소개 합다.
두부라이스떡볶이,한국의 매운맛!  우리 고유의 발효식품 고추장 한국인들은 물론 이젠 세계인들의 입맛을 확 사로 잡은 K소스로 우뚝! 찹쌀에 고추가루 엿기름과 메줏가루를 섞어 만든 한국 전통 양념장 중의 하나로 임진왜란 이후부터 먹었다고 전해지지만 정확한 시기는 물음표! 익히거나 찌는 음식의 대표 주자  밥과 떡의 대체 식품 등장!  고소 두부 라이스페이퍼 떡의 쫄깃함 식감 재연 전통 국민 간식 '두부라이스떡볶이' 소개합니다.
고구마피자,밀가루 없이 만드는 달콤한 고구마피자 입니다. 
라이스페이페피자,아주 간다한 다이어트 라이스페이퍼 피자 만들기!
고구마피자,프라이팬을 이용해서 해도 되고요? 저는 에어프라이어로 해봤어요  ?
바지락빠에야,한국인의 입맛에 맞게 변형된 파에야!! 
가지치즈구이,아이들도 좋아하는 간식~ 가지에 치즈 듬뿍 올려 오븐에 구웠어요
가지치즈구이,가지를 피자 도우처럼 활용해서 맛있게 먹을 수 있는 가지치즈구이  가지피자를 만들어 봤어요. 에어프라이어를 활용한 간단한 레시피입니다.
고구마뇨끼,로얄벌꿀고구마로 만드는 달콤하고 쫀득한 고구마 뇨끼입니다. 
닭가슴살감바스,크리스마스 맞이를 준비하여 집에서  만들 수 있는 닭가슴살을 활용한 레시피 1탄 공개! (2탄까지 있어요)
만두크림스튜,맛있는 만두에 크림스튜의 부드러움가 만나면? 입안 가득 퍼지는 풍미에 올 겨울이 따뜻해져요.
계란쌀피자,오늘은 밀가루없이 계란 3알로 만드는 꼬소하고 속이 편안한 계란쌀피자를 만들어봤어요. 재료도 단순하고 만드는 방법도 굉장히 간단해서 요린이분들도 쉽게 따라하실 수 있어요. 그럼 오늘도 맛있게 만들어볼게요:)
배추만두,주당다이어터의 과식해도되는 만두 
깻잎파스타,한식과 양식이 만난 퓨전파스타!! 느끼하지 않은 비빔국수 같은 맛~~
화이트샥슈카,토마토가 베이스인 샥슈카를 토마토 대신 우유와 치즈를 넣어 고소한 풍미를 살렸어요!  생크림  우유  치즈를 넣어 고소한 맛을 더한 ‘화이트샥슈카’  그냥 먹어도 맛있지만  빵과 함께 먹으면 더 맛있어요.
쉬림프피자,소싯적에 즐겨 해 먹던 요리에서 아이디어를 얻어  아이의 첫 피자를 구웠어요. 밀가루나 쌀가루 대신 철분이 풍부한 감자와 달걀로 만든 건강 도우. 거기에 새우와 궁합이 좋은 애호박과 표고버섯 토핑을 더했어요. 영양 만점 엄마표 특식이니  남녀노소 상관없이 안심하고 즐길 수 있겠지요.
불고기고구마피자,불고기 양념과 익힌 고구마만 있으면 뚝딱 만들 수 있는 불고기피자에요. 
당근채전,채소마스터클래스 책 레시피 참고하여 만들어본 당근뢰스티! 재료도 만드는방법도 간단하지만 정말 독특하고 색다르고 맛있어요 :)
불고기피자,#나혼자산다 #달랏피자 #달랏피자따라하기 #달랏피자만들기  #양념소불고기 #파라타피자 #토마토소스 #인도파이피자  #쫀득한파라타피자 #한끼간식  ?  ?  나혼자산다에서 팜유패밀리가 베트남 달랏여행을 갔습니다.  첫번째로 먹었던 쌀반죽의 도우에  토마토소스와 소시지를 넣고 만든 바삭한 달랏피자였습니다.  ?  어  들어가는 재료도 간단하고 파라타로 만들면 좋겠다.  파라타는 인도의 파이같은 전통빵입니다.  겉은 바삭하고 속은 쫄깃쫄깃한 식감이지요.  ?  그것은 냉동된 상태 그대로 달궈진 약불의 팬에 올려서  구워 먹는 것인데  난과는 다릅니다. 파이이지요.  ?  그 파이에 달랏피자처럼 토핑을 올려서 접어서 먹는 달랏피자입니다.  달랏피자따라하기 ^^
누룽지리조또,원래는 생쌀을 넣어 만들어 먹지만  저는 집에 있는 누룽지를 이용해서 조금 간편하게 만들어 보았답니다~
해장파스타,칼칼한 파스타로 해장 가능? 바지락  새우를 넣어 시원함을 더하고 고추가루  고추장에 청양고추 팍팍!  얼큰하고 칼칼해 땀도 쭉 빼주고 속을 풀어주는 해장파스타 완성~
시금치계란피자,월남쌈 먹고 남은 라이스페이퍼와 냉장고 자투리 채소를 토핑으로 사용하여 간단한 시금치 계란 피자를 만들어 보았어요. 
까르보나라떡볶이,집에 우유랑 생크림이 유통기한이 다 되서  어떻게 할까하다 우유랑 생크림 듬뿍넣어 넣어 까르보나라 떡볶이만들었어요~~
불고기또띠아롤,반찬을 해 먹다보면 남을 경우가 있습니다 오늘은 남은 불고기를 이용해 또띠아롤을 만들어 한끼 식사대용으로도 가능한 불고기또띠아롤을 만들었습니다
고추장불고기라자냐,한국식 라자냐 매콤라자냐 집에서도 만들어 드세요!!
순두부그라탕,담백하고 부드러운 맛에 토마토소스와 버섯을 더해 쭈욱 늘어나는 치즈를 올려 부담 없이 즐겨먹기 좋은 순두부요리에요~ 
감자치즈또띠아,정말 맛있는 초간단 간식입니다. 한끼 식사로 충분합니다
치즈불고기피자,불고기 요리 해 먹고 남은 걸로 이용할 수 있는 간식이자 혼술안주에 야식으로도 좋은 또띠아피자를 소개합니다 명절음식으로 남은 고기요리 어떤걸 활용해도 좋습니다
떡국그라탕,설명절 잘 보내셨나요? 명절이 지나면 남은건 떡국떡과... 피곤한 육신뿐.. ㅎㅎ 남은 떡국떡으로 떡국을 끓여먹자니 왠지 질리는거 같고.... 냉동실에 넣으면 내년 설날에나 볼 수 있을거 같으니.. 떡국떡처리방법으로 연휴동안 간단한 한끼 어떠세요?
잡채만두,명절지나면 명절음식 처치곤란이죠. 그렇다고 아까운 음식 버릴 수도 없고 며칠을 먹자면 곤욕이죠. 약간만 달리 요리하면 전혀 새로운 요리가 탄생합니다. 잡채야끼만두도 초초초간단 레시피이면서 명절잡채를 이용해서 만들어 먹는 요리입니다.
아보카도토마토리조또,찬밥이 있길래 만들어본 아보카도 토마토 리조또 입니다.
나물밥피자,명절때 남은 나물로 밥피자로 변신시켜보세요.
양배추크림롤,다이어트할때 두부와 양배추는 필수!!  두가지재료로 맛있는 양배추크림롤 만드는 레시피입니다.
깐풍동그랑땡,명절보내고 남은 동그랑땡 더 맛있게 먹기 명절에 남은 음식을 어떻게 활용하면 좋을까?  그냥 구워 먹어도 맛있지만  깐풍소스와 함께 볶아주면 중화풍 동그랑땡 요리 완성~ 
감자피자,오늘의 감자요리는 밀가루 안에 감자를 넣는 것이다.  으깬 감자요리로 감자피자 만드는 법을 소개한다.  고소하고 맛있다.
차돌박이곱창,?곱창은 평상시 잘 즐기지않는데 남편과 아이들은 좋아하는 메뉴 중의 하나입니다. 그래서 가끔 외식메뉴로 정하기도 합니다. 오늘은 편스토랑에 나온 차돌박이를 이용해서 곱창을 만들었네요. 일명 차돌박이곱창 정말로 곱창 같기도 하고 탕수육 같기도 합니다.  ?
돼지고기토마토리조또,토마토 리조또에 다진 돼지고기를 볶아 넣은 이탈리아 요리에요.
건두부볶음,오늘은 두부면을 가지고 중화풍 느낌이 나는 두부면볶음을 만들어 봤어요. 식사로 먹기도 좋은 메뉴입니다.
밥피자,아이들이 좋아하는 피자의 도우를 흑미밥으로 대체한 아이들 간식겸 식사용으로 만든 밥피자입니다
옥수수전,옥수수 캔 요리 간단하게 만드는 간식으로 좋아요
명란오일파스타,명란 하나로 너무 간단하게 만들수있는 명란파스타 
김치피자탕수육,탕수육을 혼자 시켜먹고 남았을 때 뭘 먹을까 하다가 김치피자탕수육을 만들어먹었어요-! 너무 맛있어서 김피탕 만들려고 탕수육시켜야 하나 했네요 ㅎㅎㅎ! 맛있게 드시고 팔로우  스크랩  댓글 많이많이 부탁드려욤♥
파히타,가족들을 위한 이색 특별식 준비했어요 맛있는거 먹을때가 행복한 아이들 맛있는 이색 쌈요리입니다 주말에 특별메뉴로 좋아요
순두부그라탕,요즘처럼 추운 날씨 아침에 보통 뭐 드시나요? 든든하게 먹어도 소화가 잘 되고 술술 넘어가는 양배추 순두부 그랑탕을 소개합니다
불고기크림리조또,불고기를 좋아해서 자주 먹는데 한 번씩 애매하게 남더라구요 그럴 때 활용해도 되고 그냥 크림리조또가 먹고 싶을 때 조금 더 맛있게 먹을 수 있는 불고기 크림리조또입니다! 크림의 고소한 맛  불고기의 달달하고 짭조름한 맛  한번씩 씹히는 청양고추의 매콤한 맛까지 거의 모든 맛이 들어있어요
양송이피자,양송이피자는 양송이버섯 위에 피자 토핑과 피자치즈를 올려 먹는 간단한 요리인데요. 캠핑요리로도 좋고 고기 구워먹을 때  쫌 색다르게 이렇게 구워먹어도 맛있어요.
감자또띠아피자,아이들 방학 삼시세끼에 간식까치 챙겨주려니 어질어질 하네요 ㅋㅋ 사실 매일 간식은 챙기지 못하지만 일주일에 한번꼴로 맛있는거 만들어  주려고 노력하는 중이에요^^ 오늘은 간단한 감자피자~ 아이들과 함께 만들어보세요 
닭가슴살또띠아샌드,한끼에 모든 영양을 가득! 탄.단.지 어느하나 부족함 없는 맛있게 먹으면 0Kcal 레시피!  담백한 닭가슴살 소시지를 활용한 작성자의 최애 메뉴   닭가슴살 또띠아 샌드 
두부피자,두부찜  두부구이  두부강정 또?? 뭐가 있을까...다른 음식은 없을까? 하다가 만들어 본 두부 피자 입니다. 아이들 간식 또는 어른들 맥주 안주로도 좋을 것 같네요.
오트밀야채피자,피자는 먹고 싶은데 다이어트로 먹는 걸 참는다? 간단하고 다이어트 식단으로도 훌륭한 오트밀 피자를 소개합니다~^^
깻잎김치,맛있는 깻잎김치 만들어 볼께요.
라면피자,만들기 간단하고 야식 맥주안주로 최고에요 
두부프리타타,계란과 여러가지 야채와 치즈로 만드는 프리타타는 이태리 오믈렛이예요. 계란물에 냉파 야채들과 베이컨  햄  소세지등을 넣고 위에 치즈나 모짤렐라 치즈 등을 얹어 약한 불에서 타지 않게 뚜껑을 덮고 익히는 요리예요. 오늘은 두부를 1cm 큐브 모양으로 썰어 후라이팬에 구워서 치즈와 야채를 넣고 만들었더니 치즈와 두부와 계란이 찰떡궁합이예요. 담백한 두부맛을 치즈가 끌어 올려 고소하고 짭쪼롬한 풍미가 환상이예요. 냉장고에 있던 체다 치즈 브리치즈 까망베르 치즈를 골고루 넣어 줬어요. 만들기도 쉽고 가볍게 먹을 수 있어 아침식사로 먹기에 너무 좋은 메뉴예요. 두부를 볶아 물기를 제거해서 고소한 맛이 치즈와 계란과 너무 잘 어우러져요. 밥반찬으로 먹어도 좋고 단독으로 오믈렛으로 먹어도 좋아요. 두부가 들어가 더 건강에도 좋고 포만감도 느끼게 되요. 색감을 고려해서 재료를 배치하면 더 맛있어 보이겠죠?!
고구마피자,밀가루 없이 달콤한 고구마로 피자만드는 레시피 입니다. 달콤한게 너무 맛있어요.
수플레오믈렛,한창 코로나가 심할 때 커피 400번 저어서 달고나 커피 만들었던 적 있죠ㅎㅎ 그 이후 나왔던 1000번 저어 계란후라이 만드는 것도 있었는데요 따지면 수플레오믈렛이라 할 수 있는 이것! 폭신폭신하면서 부드러운 맛이 포인트예요
라면피자,밀가루도우 없이 라면으로 만드는 피자.. 맥주안주로도 한끼식사로도 맛있게 즐길수 있어요.
전복감바스,감바스하면 생각나는 비주얼은 항상 새우가 있는데요. 새우가 들어간 감바스는 너무 익숙하니까 색다르게 전복을 이용해서 만들어본 감바스입니다! 역시나 맛이 너무 좋아요!
두부짜조,좀 더 건강하고 맛있는 식재료 두부로 짜조를 만들어보았어요. 두부를 안좋아하는 남녀노소 모두도 사랑하는 레시피예요^^ 첨가된 약간의 고기를 뺀다면  약간 라이트하게 드시기도 좋고  채식주의자도 맛있게 먹을수 있는 두부짜조랍니다.
두부크림크로켓,두부는 순백의 색처럼 다양하게 요리하기 좋은 재료죠. 오늘은 크림소스와 함께 바삭하게 튀겨본 두부크림크로켓 만들기입니다. 겉은 바삭하지만 두부가 들어가서 속은 훨씬 부드럽고 촉촉하고 참 맛있어요. 그냥 먹어도 맛있고 케첩에 찍어먹어도 맛있고 식어도 맛있습니다. 
두부팝콘,어린이 간식으로 좋은 겉바속촉 별미 두부요리두부팝콘입니다
떡국떡피자,아이들 간식으로도 좋고  떡국떡 넉넉히 넣으면  든든 한 끼가 되어 주기도 하는  떡국떡 떠먹는피자 입니다
두부그라탕,프랑스 국민 음식인 그라탱~~!! 프랑스 남동부의 도피네 지역에서는 감자를 넣어 만든 그라탱을 많이 먹는다고 해요. 만드는 방법이 키쉬하고도 비슷해  맛에 거부감도 없고 영양도 풍부합니다.
도토리묵탕수,묵말랭이는 볶아 먹으면 쫄깃해 식감도 좋고 너무 맛있는데  바삭하게 묵튀김으로 변신시켜 보았어요~ 묵튀김! 한마디로 예술입니다ㅋㅋ  맛보장이고 너무 맛있으니 꼭 해 드셔요~
또띠아고르곤졸라피자,평소에 이탈리안 레스토랑에 가면 꼭 사먹는 피자 중 하나가 바로 고르곤졸라피자인데요  얼마전 마트에 갔다가 발견한 고르곤졸라치즈를 활용해서 집에서 직접 또띠아 고르곤졸라 피자 만들기를 해보았어요. 생각보다 만드는법도 간편했던 레시피 알려드릴게요.
포두부알리오올리오파스타,평소 제일 좋아하는 알리오올리오 파스타! 포두부면 으로 볶아먹었더니 생각보다 더 맛있어서 완전 깜놀!!  페페론치노 넣고 매콤하게 볶아먹었더니 밥 먹고 간식으로 먹었는데도 한그릇이 호로록 순삭이더라구요^^
늙은호박피자,늙은호박으로 오늘은 간단 피자를 만들었어요. 아이들도 정말 잘 먹는 늙은호박피자 만드는법 소개 합니다.
두부하와이안피자,두부도 좋아하는데  새로운 두부 요리는 없나 궁금하고... 피자도 좋아하는데  도우를 빼고 만들 수 없나 궁금하고... 육류  햄 같은 것이 없이 피자를 만드는 방법이 없을까? 궁금할 때 만들어보았습니다.
당근치즈전,색깔도 이쁘고 이름도 귀여운데  아이들이 잘 먹지 않는 뿌리채소 당근! 저희 집 둘째도 당근을 좋아하지 않아서 어떻게 하면 먹게 할 수 있을까를 고민하다가 만들어진 음식이라고나 할까요~
두부프렌치토스트,건강에도 좋고 맛도 좋은 두부 요리~ 브런치로 드시기 좋은 멋진 두부 요리입니다. 식빵 대신 두부로 만든 프렌치 토스트~ 다이어트 하시는 분들이 드셔도 좋고 어른  아이 누구나 드셔도 좋은 건강한 두부 요리입니다.~
